MSFT,98052-6399,Technology,221000.0,"Microsoft Corporation develops, licenses, and supports software, services, devices, and solutions worldwide. The company operates in three segments: Productivity and Business Processes, Intelligent Cloud, and More Personal Computing. The Productivity and Business Processes segment offers Office, Exchange, SharePoint, Microsoft Teams, Office 365 Security and Compliance, Microsoft Viva, and Skype for Business; Skype, Outlook.com, OneDrive, and LinkedIn; and Dynamics 365, a set of cloud-based and on-premises business solutions for organizations and enterprise divisions. The Intelligent Cloud segment licenses SQL, Windows Servers, Visual Studio, System Center, and related Client Access Licenses; GitHub that provides a collaboration platform and code hosting service for developers; Nuance provides healthcare and enterprise AI solutions; and Azure, a cloud platform. It also offers enterprise support, Microsoft consulting, and nuance professional services to assist customers in developing, deploying, and managing Microsoft server and desktop solutions; and training and certification on Microsoft products. The More Personal Computing segment provides Windows original equipment manufacturer (OEM) licensing and other non-volume licensing of the Windows operating system; Windows Commercial, such as volume licensing of the Windows operating system, Windows cloud services, and other Windows commercial offerings; patent licensing; and Windows Internet of Things. It also offers Surface, PC accessories, PCs, tablets, gaming and entertainment consoles, and other devices; Gaming, including Xbox hardware, and Xbox content and services; video games and third-party video game royalties; and Search, including Bing and Microsoft advertising. The company sells its products through OEMs, distributors, and resellers; and directly through digital marketplaces, online stores, and retail stores. Microsoft Corporation was founded in 1975 and is headquartered in Redmond, Washington.",Redmond,425 882 8080,WA,United States,[],https://www.microsoft.com,1,One Microsoft Way,Software—Infrastructure,0.49418998,0.36686,0.68402,89034997760.0,0.124,0.42055,97982996480.0,275.0,buy,135620000000,49479000064.0,330.0,282.37,0.031,1.785,0.14919,46.0,336.82,47.075,0.47151002,411.0,104748998656,78399995904,198269992960,14.045,USD,26.45,1.567,1.7,NMS,Microsoft Corporation,Microsoft Corporation,America/New_York,EDT,False,-14400000,EQUITY,finmb_21835,us_market,,10.537,,21.321,-0.020071864,,12.11,,7457889792.0,,,,22.313,38999356,0.0052,,1656547200,0.72111,72737996800,9.69,0.62,-0.06414485,12.654955,0.00075,1719705600,,1656547200,1.42,1655251200,7450881454,0.927206,2089082028032,2,,1045526400.0,2:1,,1652832000.0,,0.017,10.621296,1657843200,1.77,,23.317093,,0.0052,48150433,0.0,,,283.65,279.15,295.2558,0.00874317,0.2508,,283.65,,27975910,283.65,262.917,2.48,279.15,,27975910,,,2.48,1660694400.0,,,278.68,USD,29.140352,10450026,,,,2105884278784.0,,,29791038,278.68,282.26,1300,10450026,349.67,,1.23,241.51,282.22,False,0.0088,900,283.65,,282.37,279.13,https://logo.clearbit.com/microsoft.com,2.104,425 706 7329,,,,,
NKE,97005-6453,Consumer Cyclical,79100.0,"NIKE, Inc., together with its subsidiaries, designs, develops, markets, and sells men's, women's, and kids athletic footwear, apparel, equipment, and accessories worldwide. The company provides athletic and casual footwear, apparel, and accessories under the Jumpman trademark; and casual sneakers, apparel, and accessories under the Converse, Chuck Taylor, All Star, One Star, Star Chevron, and Jack Purcell trademarks. In addition, it sells a line of performance equipment and accessories comprising bags, socks, sport balls, eyewear, timepieces, digital devices, bats, gloves, protective equipment, and other equipment for sports activities under the NIKE brand; and various plastic products to other manufacturers. The company markets apparel with licensed college and professional team, and league logos, as well as sells sports apparel. Additionally, it licenses unaffiliated parties to manufacture and sell apparel, digital devices, and applications and other equipment for sports activities under NIKE-owned trademarks. The company sells its products to footwear stores; sporting goods stores; athletic specialty stores; department stores; skate, tennis, and golf shops; and other retail accounts through NIKE-owned retail stores, digital platforms, independent distributors, licensees, and sales representatives. The company was formerly known as Blue Ribbon Sports, Inc. and changed its name to NIKE, Inc. in 1971. NIKE, Inc. was founded in 1964 and is headquartered in Beaverton, Oregon.",Beaverton,503 671 6453,OR,United States,[],https://investors.nike.com,1,One Bowerman Drive,Footwear & Accessories,0.16089001,0.12944001,0.45984,5187999744.0,-0.009,0.1429,7514999808.0,96.0,buy,21479000000,2899000064.0,130.0,113.6256,-0.043,2.629,0.10689,31.0,138.59,82.632,0.43112,203.0,12997000192,12627000320,46710001664,8.286,USD,29.586,1.646,2.1,NYQ,"Nike, Inc.","NIKE, Inc.",America/New_York,EDT,False,-14400000,EQUITY,finmb_291981,us_market,,3.836,,23.845,-0.33749998,,4.59,,1263650048.0,,,,9.727,14864348,0.0095,,1653955200,0.83303,6046000128,3.76,0.305,-0.06414485,11.681464,0.012410001,1717113600,,1653955200,1.64,1655251200,1247597996,1.023586,179198279680,2,,1450915200.0,2:1,,1654214400.0,,-0.046,3.8089755,1657843200,2.48,,24.755032,,0.0150999995,12853572,0.0,,,114.48,112.79,136.83125,0.010394829,0.3173,,114.275,,6279240,114.48,110.4646,1.19,112.79,,6279240,,,1.22,1654214400.0,,,112.5725,USD,30.219576,2551638,,,,177917247488.0,,,7484835,112.5725,113.53,900,2551638,179.1,,0.95,99.53,113.5,False,0.0107,900,114.275,,113.6256,112.97,https://logo.clearbit.com/investors.nike.com,2.418,,,,,,
PG,45202,Consumer Defensive,,"The Procter & Gamble Company provides branded consumer packaged goods worldwide. It operates through five segments: Beauty; Grooming; Health Care; Fabric & Home Care; and Baby, Feminine & Family Care. The Beauty segment offers conditioners, shampoos, styling aids, and treatments under the Head & Shoulders, Herbal Essences, Pantene, and Rejoice brands; and antiperspirants and deodorants, personal cleansing, and skin care products under the Olay, Old Spice, Safeguard, Secret, and SK-II brands. The Grooming segment provides shave care products and appliances under the Braun, Gillette, and Venus brand names. The Health Care segment offers toothbrushes, toothpastes, and other oral care products under the brand names of Crest and Oral-B; and gastrointestinal, rapid diagnostics, respiratory, vitamins/minerals/supplements, pain relief, and other personal health care products under the Metamucil, Neurobion, Pepto-Bismol, and Vicks brands. The Fabric & Home Care segment provides fabric enhancers, laundry additives, and laundry detergents under the Ariel, Downy, Gain, and Tide brands; and air care, dish care, P&G professional, and surface care products under the Cascade, Dawn, Fairy, Febreze, Mr. Clean, and Swiffer brands. The Baby, Feminine & Family Care segment offers baby wipes, taped diapers, and pants under the Luvs and Pampers brands; adult incontinence and feminine care products under the Always, Always Discreet, and Tampax brands; and paper towels, tissues, and toilet papers under the Bounty, Charmin, and Puffs brands. The company sells its products primarily through mass merchandisers, e-commerce, grocery stores, membership club stores, drug stores, department stores, distributors, wholesalers, specialty beauty stores, high-frequency stores, pharmacies, electronics stores, and professional channels, as well as directly to consumers. The Procter & Gamble Company was founded in 1837 and is headquartered in Cincinnati, Ohio.",Cincinnati,513 983 1100,OH,United States,[],https://www.pginvestor.com,1,One Procter & Gamble Plaza,Household & Personal Products,0.25715,0.18384,0.47427,16723000320.0,0.03,0.22214001,20619999232.0,124.0,buy,38030000000,9285749760.0,157.0,143.97,0.071,0.655,0.09413999,22.0,156.38,67.215,0.3164,180.0,7214000128,31492999168,80186998784,3.013,USD,32.636,0.374,2.4,NYQ,Procter & Gamble Company (The),The Procter & Gamble Company,America/New_York,EDT,False,-14400000,EQUITY,finmb_33328,us_market,,4.621,,17.971,0.022912145,,6.65,,2399300096.0,,,,19.572,13555712,0.0056,,1656547200,0.65818,14741999616,5.8,0.913,-0.06414485,7.3559165,0.00116,1719705600,,1656547200,1.76,1655251200,2391266710,0.342822,370556633088,2,,1087776000.0,2:1,,1658361600.0,,0.05,4.314611,1657843200,,,21.649624,,0.0057,17561811,0.0,,,144.65,143.75,151.41174,0.02435534,0.6063,,144.405,,8025110,144.65,143.2196,3.523,143.75,,8025110,,,3.65,1658361600.0,,,142.77,USD,24.822412,2803762,,,,345975717888.0,,,7505674,142.77,143.95,800,2803762,165.35,,2.68,129.5,143.92,False,0.0252,900,144.405,,143.97,144.05,https://logo.clearbit.com/pginvestor.com,4.4144,,,,,,
TRV,10017,Financial Services,30184.0,"The Travelers Companies, Inc., through its subsidiaries, provides a range of commercial and personal property, and casualty insurance products and services to businesses, government units, associations, and individuals in the United states and internationally. The company operates through three segments: Business Insurance, Bond & Specialty Insurance, and Personal Insurance. The Business Insurance segment offers workers' compensation, commercial automobile and property, general liability, commercial multi-peril, employers' liability, public and product liability, professional indemnity, marine, aviation, onshore and offshore energy, construction, terrorism, personal accident, and kidnap and ransom insurance products. This segment operates through select accounts, which serve small businesses; commercial accounts that serve mid-sized businesses; national accounts, which serve large companies; and national property and other that serve large and mid-sized customers, commercial trucking industry, and agricultural businesses, as well as markets and distributes its products through brokers, wholesale agents, and program managers. The Bond & Specialty Insurance segment provides surety, fidelity, management and professional liability, and other property and casualty coverages and related risk management services through independent agencies and brokers. The Personal Insurance segment offers property and casualty insurance covering personal risks, primarily automobile and homeowners insurance to individuals through independent agencies and brokers. The Travelers Companies, Inc. was founded in 1853 and is based in New York, New York.",New York,917 778 6000,NY,United States,[],https://www.travelers.com,1,485 Lexington Avenue,Insurance—Property & Casualty,0.15349,0.099659994,0.26227,6876000256.0,0.052,0.12933,5488999936.0,158.0,hold,9475000000,14155875328.0,176.0,159.05,-0.38,0.343,0.02446,17.0,175.12,31.875,0.137,190.0,4279000064,7290999808,35761000448,18.031,USD,147.377,0.175,2.8,NYQ,"The Travelers Companies, Inc.","The Travelers Companies, Inc.",America/New_York,EDT,False,-14400000,EQUITY,finmb_392856,us_market,,1.131,,7.367,0.03193295,,14.79,,237312992.0,,,,96.393,3454111,0.0146,,1640908800,0.85331,3537999872,14.35,0.93,-0.06414485,1.6500162,0.0021,1703980800,,1656547200,2.88,1655251200,236392344,0.635217,40436277248,2,,894931200.0,2:1,,1654732800.0,,-0.41,1.05828,1657843200,,,10.753888,,0.0146,3007035,0.0,,,157.7,158.27,167.0386,0.02263792,0.2481,,159.545,,1247180,157.7,165.778,3.57,158.27,,1247180,,,3.72,1662595200.0,,,157.97,USD,11.083624,447141,,,,37845151744.0,,,1235390,157.97,158.99,1000,447141,187.98,,2.34,145.4,158.91,False,0.0235,1100,159.545,,159.05,157.7,https://logo.clearbit.com/travelers.com,,,,,,,
UNH,55343,Healthcare,350000.0,"UnitedHealth Group Incorporated operates as a diversified health care company in the United States. It operates through four segments: UnitedHealthcare, Optum Health, Optum Insight, and Optum Rx. The UnitedHealthcare segment offers consumer-oriented health benefit plans and services for national employers, public sector employers, mid-sized employers, small businesses, and individuals; health care coverage and well-being services to individuals age 50 and older addressing their needs for preventive and acute health care services, as well as services dealing with chronic disease and other specialized issues for older individuals; Medicaid plans, children's health insurance and health care programs; health and dental benefits; and hospital and clinical services. The OptumHealth segment provides access to networks of care provider specialists, health management services, care delivery, consumer engagement, and financial services. This segment serves individuals directly through care delivery systems, employers, payers, and government entities. The OptumInsight segment offers software and information products, advisory consulting arrangements, and managed services outsourcing contracts to hospital systems, physicians, health plans, governments, life sciences companies, and other organizations. The OptumRx segment provides pharmacy care services and programs, including retail network contracting, home delivery, specialty and compounding pharmacy, and purchasing and clinical capabilities, as well as develops programs in the areas of step therapy, formulary management, drug adherence, and disease/drug therapy management. UnitedHealth Group Incorporated was incorporated in 1977 and is based in Minnetonka, Minnesota.",Minnetonka,952 936 1300,MN,United States,[],https://www.unitedhealthgroup.com,1,UnitedHealth Group Center,Healthcare Plans,0.08993,0.05954,0.24008,22987999232.0,0.126,0.08264,27569000448.0,360.0,buy,69652000000,17796749312.0,587.0,531.3475,0.197,0.771,0.0719,25.0,572.87,63.346,0.24253,632.0,27964000256,51391000576,306560991232,29.436,USD,325.782,0.526,1.8,NYQ,UnitedHealth Group Incorporated,UnitedHealth Group Incorporated,America/New_York,EDT,True,-14400000,EQUITY,finmb_104673,us_market,,1.773,,19.717,,,21.65,,941851008.0,,,,74.605,5678002,0.0061000003,,1640908800,0.8962,18254000128,16.111,,,7.122143,0.00548,1703980800,,1656547200,1.33,1655251200,945345000,0.774372,543572000768,2,,1117497600.0,2:1,,,,0.188,1.6324652,1657843200,1.73,,24.542608,,0.0061000003,5760909,,,,533.75,530.0,488.60385,0.010117096,0.31350002,,533.16,,2300340,533.75,506.3302,5.4,530.0,,2300340,,,6.6,1655337600.0,,,527.56,USD,32.980415,1377469,,,,500450164736.0,,,3332833,527.56,0.0,800,1377469,553.29,,1.36,383.12,0.0,False,0.012200001,1100,533.16,,531.3475,533.75,https://logo.clearbit.com/unitedhealthgroup.com,,,9900 Bren Road East,,,,33ae4437-560d-3a42-9aa4-234d48c993c5
CRM,94105,Technology,77810.0,"Salesforce, Inc. provides customer relationship management technology that brings companies and customers together worldwide. Its Customer 360 platform empowers its customers to work together to deliver connected experiences for their customers. The company's service offerings include Sales to store data, monitor leads and progress, forecast opportunities, gain insights through analytics and relationship intelligence, and deliver quotes, contracts, and invoices; and Service that enables companies to deliver trusted and highly personalized customer service and support at scale. Its service offerings also comprise flexible platform that enables companies of various sizes, locations, and industries to build business apps to bring them closer to their customers with drag-and-drop tools; online learning platform that allows anyone to learn in-demand Salesforce skills; and Slack, a system of engagement. In addition, the company's service offerings include Marketing offering that enables companies to plan, personalize, and optimize one-to-one customer marketing journeys; and Commerce offering, which empowers brands to unify the customer experience across mobile, web, social, and store commerce points. Further, its service offerings comprise Tableau, an end-to-end analytics solution serving various enterprise use cases; and MuleSoft, an integration offering that allows its customers to unlock data across their enterprise. The company provides its service offering for customers in financial services, healthcare and life sciences, manufacturing, and other industries. It also offers professional services; and in-person and online courses to certify its customers and partners on architecting, administering, deploying, and developing its service offerings. The company provides its services through direct sales; and consulting firms, systems integrators, and other partners. Salesforce, Inc. was incorporated in 1999 and is headquartered in San Francisco, California.",San Francisco,415 901 7000,CA,United States,[],https://www.salesforce.com,1,Salesforce Tower,Software—Application,0.09578,0.0359,0.73099,6448000000.0,0.243,0.00959,2676000000.0,157.33,buy,19466000000,9313000448.0,235.0,189.965,-0.943,1.026,0.00212,46.0,244.57,24.416,0.01977,385.0,13502999552,14375000064,27939999744,13.571,USD,28.73,0.877,1.8,NYQ,"Salesforce, Inc.","Salesforce, Inc.",America/New_York,EDT,True,-14400000,EQUITY,finmb_122917,us_market,,6.585,,68.749,,,4.71,,985000000.0,,,,57.982,11371285,0.0114,,1643587200,0.79773,1003000000,1.818,,,3.2762754,0.033010002,1706659200,,1651276800,1.73,1655251200,963229650,1.075776,183971905536,2,,1366243200.0,4:1,,,,-0.94,6.697048,1657843200,2.38,,40.33227,,0.0117999995,14086861,,,,191.27,187.0,215.807,,0.0,,191.73,,4423400,191.27,174.2646,,187.0,,4423400,,,,,,,186.28,USD,104.491196,2610629,,,,187115520000.0,,,7413259,186.28,0.0,800,2610629,311.75,,,154.55,189.48,False,,800,191.73,,189.965,187.36,https://logo.clearbit.com/salesforce.com,,415 901 7040,3rd Floor 415 Mission Street,,,,01d3fcca-fdd3-37b7-b601-1bfd3a695ce7
VZ,10036,Communication Services,119400.0,"Verizon Communications Inc., through its subsidiaries, offers communications, technology, information, and entertainment products and services to consumers, businesses, and governmental entities worldwide. Its Consumer segment provides postpaid and prepaid service plans; internet access on notebook computers and tablets; wireless equipment, including smartphones and other handsets; and wireless-enabled internet devices, such as tablets, and other wireless-enabled connected devices comprising smart watches. It also provides residential fixed connectivity solutions, such as internet, video, and voice services; and sells network access to mobile virtual network operators. As of December 31, 2021, it had approximately 115 million wireless retail connections, 7 million wireline broadband connections, and 4 million Fios video connections. The company's Business segment provides network connectivity products, including private networking, private cloud connectivity, virtual and software defined networking, and internet access services; and internet protocol-based voice and video services, unified communications and collaboration tools, and customer contact center solutions. This segment also offers a suite of management and data security services; domestic and global voice and data solutions, such as voice calling, messaging services, conferencing, contact center solutions, and private line and data access networks; customer premises equipment; installation, maintenance, and site services; and Internet of Things products and services. As of December 31, 2021, it had approximately 27 million wireless retail postpaid connections and 477 thousand wireline broadband connections. The company was formerly known as Bell Atlantic Corporation and changed its name to Verizon Communications Inc. in June 2000. Verizon Communications Inc. was incorporated in 1983 and is headquartered in New York, New York.",New York,212 395 1000,NY,United States,[],https://www.verizon.com,1,1095 Avenue of the Americas,Telecom Services,0.32123002,0.15484,0.57347,36765999104.0,0.001,0.19841999,43149000704.0,40.0,hold,77312000000,3571749888.0,51.0,44.82,-0.116,0.762,0.04631,25.0,53.57,205.118,0.26240999,69.0,1979000064,179184992256,134325002240,0.471,USD,32.151,0.54,2.9,NYQ,Verizon Communications Inc.,Verizon Communications Inc.,America/New_York,EDT,True,-14400000,EQUITY,finmb_415798,us_market,,2.773,,8.634,,,5.4,,4197760000.0,,,,18.609,42065063,0.01,,1640908800,0.64447,20799000576,5.32,,,2.408512,0.00059999997,1703980800,,1656547200,2.2,1655251200,4195304976,0.383567,372531822592,2,,1278028800.0,1000000:937889,,,,-0.104,1.4006596,1657843200,2.62,,8.3,,0.01,35311355,,,,44.43,44.48,51.4115,0.056763448,0.5141,,44.915,,25709010,44.43,49.5468,2.522,44.48,,25709010,,,2.56,1657152000.0,,,44.3601,USD,8.424811,10147980,,,,188143599616.0,,,20449301,44.3601,0.0,2200,10147980,56.2,,4.48,43.77,0.0,False,0.0554,3100,44.915,,44.82,44.43,https://logo.clearbit.com/verizon.com,,,,,,,a708480c-0400-3ea0-b2d3-ca752db5c3b1
V,94128-8999,Financial Services,21500.0,"Visa Inc. operates as a payments technology company worldwide. The company facilitates digital payments among consumers, merchants, financial institutions, businesses, strategic partners, and government entities. It operates VisaNet, a transaction processing network that enables authorization, clearing, and settlement of payment transactions. In addition, the company offers card products, platforms, and value-added services. It provides its services under the Visa, Visa Electron, Interlink, VPAY, and PLUS brands. Visa Inc. has a strategic agreement with Ooredoo to provide an enhanced payment experience for Visa cardholders and Ooredoo customers in Qatar. Visa Inc. was founded in 1958 and is headquartered in San Francisco, California.",San Francisco,650 432 3200,CA,United States,[],https://usa.visa.com,1,PO Box 8999,Credit Services,0.70465,0.51994,0.97329,16944000000.0,0.187,0.67485,19787999232.0,204.0,buy,23375000000,12285375488.0,261.6,214.47,0.359,1.427,0.14094,38.0,259.96,67.06,0.39854,296.0,17355999232,23794999296,28081999872,8.388,USD,13.391,1.046,1.8,NYQ,Visa Inc.,Visa Inc.,America/New_York,EDT,True,-14400000,EQUITY,finmb_38043467,us_market,,15.96,,22.649,,,,,,,,,,34263343,0.0162,,1632960000,0.9779,14273999872,,,,,0.00164,1696032000,,1656547200,5.52,1655251200,1633503157,0.896977,448175243264,2,,1426723200.0,4:1,,,,0.325,,1657843200,1.62,,,,0.0208,32636801,,,,213.47,210.71,211.1906,,0.21280001,,214.76,,8081550,213.47,205.5054,,210.71,,8081550,,,1.5,1652313600.0,,,210.5,USD,,2997924,,,,,,,6814374,210.5,215.03,1000,2997924,242.6,,0.6,185.91,208.51,False,0.0070999996,800,214.76,,214.47,210.28,https://logo.clearbit.com/usa.visa.com,,,,,,,5206560a-306a-3e08-9a43-7fd258eb57ce
WBA,60015,Healthcare,315000.0,"Walgreens Boots Alliance, Inc. operates as a pharmacy-led health and beauty retail company. It operates through two segments, the United States and International. The United States segment sells prescription drugs and an assortment of retail products, including health, wellness, beauty, personal care, consumable, and general merchandise products through its retail drugstores. It also provides central specialty pharmacy services and mail services. As of August 31, 2021, this segment operated 8,965 retail stores under the Walgreens and Duane Reade brands in the United States; and five specialty pharmacies. The International segment sells prescription drugs; and health and wellness, beauty, personal care, and other consumer products through its pharmacy-led health and beauty retail stores and optical practices, as well as through boots.com and an integrated mobile application. It also engages in pharmaceutical wholesaling and distribution business in Germany. As of August 31, 2021, this segment operated 4,031 retail stores under the Boots, Benavides, and Ahumada in the United Kingdom, Thailand, Norway, the Republic of Ireland, the Netherlands, Mexico, and Chile; and 548 optical practices, including 160 on a franchise basis. Walgreens Boots Alliance, Inc. was founded in 1901 and is based in Deerfield, Illinois.",Deerfield,847 315 3700,IL,United States,[],https://www.walgreensbootsalliance.com,1,108 Wilmot Road,Pharmaceutical Retailers,0.03427,0.03999,0.21826,5057999872.0,-0.042,0.021370001,4609999872.0,35.0,hold,28067000000,7945249792.0,42.0,38.835,-0.76,0.784,0.019450001,15.0,41.83,122.711,0.18168,49.0,4457999872,38233001984,134515998720,5.158,USD,155.586,0.394,3.1,NMS,"Walgreens Boots Alliance, Inc.","Walgreens Boots Alliance, Inc.",America/New_York,EDT,False,-14400000,EQUITY,finmb_93624,us_market,,0.538,,15.698,-0.17239916,,4.67,,864257024.0,,,,30.376,27272188,0.031600002,,1630368000,0.60014,5111000064,5.9,0.478,-0.06414485,1.2784765,0.17312999,1693440000,,1653955200,3.61,1655251200,714895817,0.59089,72367726592,2,,919123200.0,2:1,,1652918400.0,,-0.759,0.24951248,1657843200,,,8.3158455,,0.0381,27451715,0.0,,,38.98,38.92,45.8244,0.04899949,0.32369998,,39.135,,5702720,38.98,40.13,1.91,38.92,,5702720,,,1.92,1660780800.0,,,38.62,USD,6.582203,3389350,,,,33563420672.0,,,6647400,38.62,38.87,1000,3389350,55.0,,3.41,36.57,38.86,False,0.049000002,1200,39.135,,38.835,38.98,https://logo.clearbit.com/walgreensbootsalliance.com,,,,,,,
