HD,30339,Consumer Cyclical,500000.0,"The Home Depot, Inc. operates as a home improvement retailer. It operates The Home Depot stores that sell various building materials, home improvement products, lawn and garden products, and décor products, as well as facilities maintenance, repair, and operations products The company also offers installation services for flooring, cabinets and cabinet makeovers, countertops, furnaces and central air systems, and windows. In addition, it provides tool and equipment rental services. The company primarily serves homeowners; and professional renovators/remodelers, general contractors, maintenance professionals, handymen, property managers, building service contractors, and specialty tradesmen, such as electricians, plumbers, and painters. It also sells its products through websites, including homedepot.com; blinds.com, an online site for custom window coverings; and thecompanystore.com, an online site for textiles and décor products. As of December 31, 2021, the company operated 2,317 stores in the United States. The Home Depot, Inc. was incorporated in 1978 and is based in Atlanta, Georgia.",Atlanta,770 433 8211,GA,United States,[],https://www.homedepot.com,1,2455 Paces Ferry Road,Home Improvement Retail,0.17262,0.10828,0.33582002,14049999872.0,0.038,0.1537,26336000000.0,262.0,buy,50832000000,8576750080.0,346.0,308.485,0.06,1.115,0.19655001,31.0,348.96,,847.1282,470.0,2844000000,48475000832,152565006336,2.767,USD,146.17,0.223,2.1,NYQ,"Home Depot, Inc. (The)","The Home Depot, Inc.",America/New_York,EDT,False,-14400000,EQUITY,finmb_278679,us_market,,2.363,,13.689,-0.068730295,,17.33,,1027750016.0,,,,-1.661,7841714,0.0076,,1643500800,0.71075,16519000064,15.76,1.9,-0.06414485,,0.00075999997,1706572800,,1651363200,1.93,1655251200,1026531918,0.991459,360504295424,2,,946598400.0,3:2,,1654041600.0,,0.021,2.0781007,1657843200,1.19,,17.800634,,0.0076,9482897,0.0,,,307.17,305.38,336.07834,0.023114234,0.4346,,308.81,,2989500,307.17,291.401,7.1,305.38,,2989500,,,7.6,1654041600.0,,,304.495,USD,19.57392,1145639,,,,317045440512.0,,,4038029,304.495,308.06,900,1145639,420.61,,2.14,264.51,308.05,False,0.0248,1000,308.81,,308.485,305.0,https://logo.clearbit.com/homedepot.com,2.6173,,,,,,
HON,28202,Industrials,99000.0,"Honeywell International Inc. operates as a diversified technology and manufacturing company worldwide. Its Aerospace segment offers auxiliary power units, propulsion engines, integrated avionics, environmental control and electric power systems, engine controls, flight safety, communications, navigation hardware, data and software applications, radar and surveillance systems, aircraft lighting, advanced systems and instruments, satellite and space components, and aircraft wheels and brakes; spare parts; repair, overhaul, and maintenance services; thermal systems, as well as wireless connectivity and management services. The company's Honeywell Building Technologies segment offers software applications for building control and optimization; sensors, switches, control systems, and instruments for energy management; access control; video surveillance; fire products; and installation, maintenance, and upgrades of systems. Its Performance Materials and Technologies segment offers automation control, instrumentation, and software and related services; catalysts and adsorbents, equipment, and consulting; and materials to manufacture end products, such as bullet-resistant armor, nylon, computer chips, and pharmaceutical packaging, as well as provides reduced and low global-warming-potential materials based on hydrofluoro-olefin technology. The company's Safety and Productivity Solutions segment provides personal protection equipment, apparel, gear, and footwear; gas detection technology; cloud-based notification and emergency messaging; mobile devices and software; supply chain and warehouse automation equipment, and software solutions; custom-engineered sensors, switches, and controls; and data and asset management productivity software solutions. The company was founded in 1906 and is headquartered in Charlotte, North Carolina.",Charlotte,704 627 6200,NC,United States,[],https://www.honeywell.com,1,855 South Mint Street,Conglomerates,0.24304001,0.14741999,0.32087,4607000064.0,0.016,0.20813,8375000064.0,183.0,buy,10998000000,3413125120.0,205.5,192.1019,-0.098,1.196,0.071040004,24.0,206.9,110.32,0.28083,230.0,8659000320,20074999808,34459000832,12.853,USD,50.254,0.831,2.3,NMS,Honeywell International Inc.,Honeywell International Inc.,America/New_York,EDT,False,-14400000,EQUITY,finmb_1340740,us_market,,4.113,,16.923,-0.16213864,,9.63,,680732992.0,,,,26.037,5561955,0.0082,,1640908800,0.76251,5080000000,7.33,0.98,-0.06414485,7.378035,0.00096000003,1703980800,,1656547200,1.9,1655251200,639502432,1.082588,141730824192,2,,1540771200.0,1032:1000,,1652313600.0,,-0.118,3.7949476,1657843200,2.35,,19.948277,,0.0082,6157286,0.0,,,192.44,191.57,197.0025,0.020110164,0.528,,192.4,,2656230,192.44,182.9718,3.87,191.57,,2656230,,,3.92,1652313600.0,,,190.34,USD,26.207626,913704,,,,130770100224.0,,,2840575,190.34,192.32,800,913704,234.68,,1.94,167.35,192.27,False,0.020399999,900,192.4,,192.1019,190.25,https://logo.clearbit.com/honeywell.com,1.956,,,,,,
IBM,10504,Technology,282100.0,"International Business Machines Corporation provides integrated solutions and services worldwide. The company operates through four business segments: Software, Consulting, Infrastructure, and Financing. The Software segment offers hybrid cloud platform and software solutions, such as Red Hat, an enterprise open-source solutions; software for business automation, AIOps and management, integration, and application servers; data and artificial intelligence solutions; and security software and services for threat, data, and identity. This segment also provides transaction processing software that supports clients' mission-critical and on-premise workloads in banking, airlines, and retail industries. The Consulting segment offers business transformation services, including strategy, business process design and operations, data and analytics, and system integration services; technology consulting services; and application and cloud platform services. The Infrastructure segment provides on-premises and cloud-based server and storage solutions for its clients' mission-critical and regulated workloads; and support services and solutions for hybrid cloud infrastructure, as well as remanufacturing and remarketing services for used equipment. The Financing segment offers lease, installment payment, loan financing, and short-term working capital financing services. The company was formerly known as Computing-Tabulating-Recording Co. International Business Machines Corporation was incorporated in 1911 and is headquartered in Armonk, New York.",Armonk,914 499 1900,NY,United States,[],https://www.ibm.com,1,One New Orchard Road,Information Technology Services,0.20374,0.09363,0.54011,9825999872.0,0.093,0.11046,12158999552.0,115.0,hold,31486000000,6312374784.0,143.0,132.17,0.041,0.876,0.03004,19.0,142.82,274.055,0.2709,160.0,7558000128,53375000576,59679997952,8.368,USD,66.383,0.675,2.7,NYQ,International Business Machines,International Business Machines Corporation,America/New_York,EDT,False,-14400000,EQUITY,finmb_112350,us_market,,2.772,,13.604,-0.044378936,,10.12,,896320000.0,,,,21.49,22411185,0.0248,,1640908800,0.56962,5626999808,6.089,1.65,-0.06414485,6.1503024,0.00090000004,1703980800,,1656547200,4.47,1655251200,901617851,0.852785,165410881536,2,,1635984000.0,1046:1000,,1652054400.0,,0.051,1.9850304,1657843200,1.57,,13.060277,,0.0248,21306204,,,,131.64,131.25,130.3291,0.049984805,1.0580001,,132.4,,4349970,131.64,136.5358,6.58,131.25,,4349970,,,6.6,1660003200.0,,,131.08,USD,21.706354,1410444,,,,118466609152.0,,,5545901,131.08,132.16,800,1410444,144.73,,4.74,114.56,132.14,False,0.0499,1400,132.4,,132.17,131.21,https://logo.clearbit.com/ibm.com,1.7929,,,,,,
INTC,95054-1549,Technology,121100.0,"Intel Corporation engages in the design, manufacture, and sale of computer products and technologies worldwide. The company operates through CCG, DCG, IOTG, Mobileye, NSG, PSG, and All Other segments. It offers platform products, such as central processing units and chipsets, and system-on-chip and multichip packages; and non-platform or adjacent products, including accelerators, boards and systems, connectivity products, graphics, and memory and storage products. The company also provides high-performance compute solutions for targeted verticals and embedded applications for retail, industrial, and healthcare markets; and solutions for assisted and autonomous driving comprising compute platforms, computer vision and machine learning-based sensing, mapping and localization, driving policy, and active sensors. In addition, it offers workload-optimized platforms and related products for cloud service providers, enterprise and government, and communications service providers. The company serves original equipment manufacturers, original design manufacturers, and cloud service providers. Intel Corporation has a strategic partnership with MILA to develop and apply advances in artificial intelligence methods for enhancing the search in the space of drugs. The company was incorporated in 1968 and is headquartered in Santa Clara, California.",Santa Clara,408 765 8080,CA,United States,[],https://www.intel.com,1,2200 Mission College Boulevard,Semiconductors,0.34515998,0.26031,0.49848998,22542000128.0,-0.22,0.17446,25333000192.0,30.0,hold,43815000000,2844124928.0,40.0,35.285,,1.859,0.049239997,36.0,42.86,35.004,0.20496,74.0,27043999744,35429998592,73394003968,6.586,USD,17.989,1.234,3.0,NMS,Intel Corporation,Intel Corporation,America/New_York,EDT,False,-14400000,EQUITY,finmb_21127,us_market,,2.109,,6.111,-0.33864987,,3.46,,4105999872.0,,,,24.651,70008195,0.0171,,1640390400,0.63490003,19104999424,4.55,0.365,-0.06414485,1.4313822,0.00061,1703462400,,1656720000,2.02,1655251200,4101688700,0.619357,154805960704,2,,965001600.0,2:1,,1659571200.0,,,2.021611,1657843200,3.93,,10.197977,,0.0171,79043921,0.0,,,35.66,35.345,46.4818,0.03996074,0.3058,,35.69,,55394790,35.66,39.1944,1.425,35.345,,55394790,,,1.46,1659571200.0,,,35.18,USD,7.754945,25666702,,,,148374126592.0,,,38486506,35.18,35.27,3000,25666702,56.28,,2.52,35.18,35.26,False,0.04,3100,35.69,,35.285,35.36,https://logo.clearbit.com/intel.com,4.8047,,,,,,
JNJ,08933,Healthcare,141700.0,"Johnson & Johnson, together with its subsidiaries, researches and develops, manufactures, and sells various products in the healthcare field worldwide. The company's Consumer Health segment offers baby care products under the JOHNSON'S and AVEENO Baby brands; oral care products under the LISTERINE brand; skin health/beauty products under the AVEENO, CLEAN & CLEAR, DR. CI:LABO, NEUTROGENA, and OGX brands; TYLENOL acetaminophen products; SUDAFED cold, flu, and allergy products; BENADRYL and ZYRTEC allergy products; MOTRIN IB ibuprofen products; NICORETTE smoking cessation products; and PEPCID acid reflux products. It also offers STAYFREE and CAREFREE sanitary pads; o.b. tampons; adhesive bandages under the BAND-AID brand; and first aid products under the NEOSPORIN brand. It serves general public, retail outlets, and distributors. The company's Pharmaceutical segment offers products for rheumatoid arthritis, psoriatic arthritis, inflammatory bowel disease, and psoriasis; HIV/AIDS and COVID-19 infectious diseases; mood disorders, neurodegenerative disorders, and schizophrenia; prostate cancer, hematologic malignancies, lung cancer, and bladder cancer; thrombosis, diabetes and macular degeneration; and pulmonary arterial hypertension. This segment serves retailers, wholesalers, distributors, hospitals, and healthcare professionals directly for prescription use. Its MedTech segment provides electrophysiology products to treat cardiovascular diseases; neurovascular care products to treat hemorrhagic and ischemic stroke; orthopaedics products in support of hips, knees, trauma, spine, sports, and other; advanced and general surgery solutions that focus on breast aesthetics, ear, nose, and throat procedures; and disposable contact lenses and ophthalmic products related to cataract and laser refractive surgery under the ACUVUE brand. This segment serves wholesalers, hospitals, and retailers. The company was founded in 1886 and is based in New Brunswick, New Jersey.",New Brunswick,732 524 0400,NJ,United States,[],https://www.jnj.com,1,One Johnson & Johnson Plaza,Drug Manufacturers—General,0.33877,0.19214001,0.6795,23581999104.0,0.03,0.26376,32381999104.0,165.0,buy,64020000000,22485499904.0,187.0,171.16,-0.234,1.424,0.08898,19.0,187.84,42.69,0.2517,215.0,32568000512,32597000192,95587999744,12.387,USD,36.334,1.087,2.4,NYQ,Johnson & Johnson,Johnson & Johnson,America/New_York,EDT,False,-14400000,EQUITY,finmb_139677,us_market,,4.802,,14.176,-0.007625222,,10.58,,2629179904.0,,,,29.044,13613059,0.0052,,1641081600,0.70325,18365999104,6.87,1.13,-0.06414485,5.8931274,0.00090000004,1704153600,,1656806400,1.91,1655251200,2625761961,0.589263,459057528832,2,,992390400.0,2:1,,1653264000.0,,-0.233,4.7078133,1657843200,4.26,,16.177694,,0.0052,15394152,0.0,,,171.79,171.3,171.75705,0.025088772,0.62740004,,171.49,,5174800,171.79,175.6214,4.31,171.3,,5174800,,,4.52,1661126400.0,,,169.8,USD,24.91412,2997064,,,,450010447872.0,,,6815009,169.8,171.08,1000,2997064,186.69,,2.58,155.72,171.07,False,0.025899999,800,171.49,,171.16,171.4,https://logo.clearbit.com/jnj.com,4.0508,,,,,,
KO,30313,Consumer Defensive,79000.0,"The Coca-Cola Company, a beverage company, manufactures, markets, and sells various nonalcoholic beverages worldwide. The company provides sparkling soft drinks; flavored and enhanced water, and sports drinks; juice, dairy, and plantbased beverages; tea and coffee; and energy drinks. It also offers beverage concentrates and syrups, as well as fountain syrups to fountain retailers, such as restaurants and convenience stores. The company sells its products under the Coca-Cola, Diet Coke/Coca-Cola Light, Coca-Cola Zero Sugar, Fanta, Fresca, Schweppes, Sprite, Thums Up, Aquarius, Ciel, dogadan, Dasani, glacéau smartwater, glacéau vitaminwater, Ice Dew, I LOHAS, Powerade, Topo Chico, AdeS, Del Valle, fairlife, innocent, Minute Maid, Minute Maid Pulpy, Simply, Ayataka, BODYARMOR, Costa, FUZE TEA, Georgia, and Gold Peak brands. It operates through a network of independent bottling partners, distributors, wholesalers, and retailers, as well as through bottling and distribution operators. The company was founded in 1886 and is headquartered in Atlanta, Georgia.",Atlanta,404 676 2121,GA,United States,[],https://www.coca-colacompany.com,1,One Coca-Cola Plaza,Beverages—Non-Alcoholic,0.32012,0.23162001,0.58894,11646000128.0,0.118,0.28746998,13228000256.0,58.42,buy,23298000000,7478499840.0,70.0,63.07,-0.279,1.127,0.080979995,23.0,69.21,172.628,0.39211,75.0,11619000320,42816999424,41322000384,2.687,USD,9.553,0.785,2.1,NYQ,Coca-Cola Company (The),The Coca-Cola Company,America/New_York,EDT,False,-14400000,EQUITY,finmb_26642,us_market,,7.514,,23.473,0.124117255,,2.61,,4324630016.0,,,,5.318,34236546,0.007900001,,1640908800,0.71133006,9571000320,2.2,0.44,-0.06414485,11.859722,0.0066299997,1703980800,,1656633600,2.13,1655251200,3894458310,0.557684,310507438080,2,,1344816000.0,2:1,,1655164800.0,,-0.279,6.6007066,1657843200,4.71,,24.164751,,0.008,30535339,0.0,,,63.67,63.63,60.6435,0.027014293,0.78180003,,63.64,,13459980,63.67,62.5918,1.72,63.63,,13459980,,,1.76,1663200000.0,,,62.67,USD,28.66818,6269856,,,,272754409472.0,,,16990719,62.67,63.03,900,6269856,67.2,,3.14,52.28,63.02,False,0.0274,1100,63.64,,63.07,63.81,https://logo.clearbit.com/coca-colacompany.com,3.5643,,,,,,
JPM,10179,Financial Services,278494.0,"JPMorgan Chase & Co. operates as a financial services company worldwide. It operates through four segments: Consumer & Community Banking (CCB), Corporate & Investment Bank (CIB), Commercial Banking (CB), and Asset & Wealth Management (AWM). The CCB segment offers s deposit, investment and lending products, payments, and services to consumers; lending, deposit, and cash management and payment solutions to small businesses; mortgage origination and servicing activities; residential mortgages and home equity loans; and credit card, auto loan, and leasing services. The CIB segment provides investment banking products and services, including corporate strategy and structure advisory, and equity and debt markets capital-raising services, as well as loan origination and syndication; payments and cross-border financing; and cash and derivative instruments, risk management solutions, prime brokerage, and research. This segment also offers securities services, including custody, fund accounting and administration, and securities lending products for asset managers, insurance companies, and public and private investment funds. The CB segment provides financial solutions, including lending, payments, investment banking, and asset management to small business, large and midsized companies, local governments, and nonprofit clients; and commercial real estate banking services to investors, developers, and owners of multifamily, office, retail, industrial, and affordable housing properties. The AWM segment offers multi-asset investment management solutions in equities, fixed income, alternatives, and money market funds to institutional clients and retail investors; and retirement products and services, brokerage, custody, trusts and estates, loans, mortgages, deposits, and investment management products. The company also provides ATM, online and mobile, and telephone banking services. JPMorgan Chase & Co. was founded in 1799 and is headquartered in New York, New York.",New York,212 270 6000,NY,United States,[],https://www.jpmorganchase.com,1,383 Madison Avenue,Banks—Diversified,0.0,0.32358003,0.0,,-0.096,0.39891,,117.0,buy,130898000000,,135.0,116.0,-0.27,,0.010369999,27.0,139.49,,0.1363,175.0,1456992944128,632410013696,120579997696,496.826,USD,40.479,,2.3,NYQ,JP Morgan Chase & Co.,JPMorgan Chase & Co.,America/New_York,EDT,False,-14400000,EQUITY,finmb_658776,us_market,,-3.833,,,-0.28660315,,12.57,,2937050112.0,,,,86.376,17731481,0.006,,1640908800,0.71048,37196001280,12.33,1.0,-0.06414485,1.3429656,0.00929,1703980800,,1656547200,1.3,1655251200,2905326820,1.103294,-462238056448,2,,960768000.0,3:2,,1656979200.0,,-0.276,2.856921,1657843200,9.48,,9.228322,,0.0061000003,18917969,0.0,,,112.36,112.53,140.3292,0.035599858,0.3208,,116.1899,,12248430,112.36,117.7902,4.0,112.53,,12248430,,,4.0,1656979200.0,,,112.05,USD,9.4079485,9817044,,,,344487526400.0,,,13179170,112.05,115.86,800,9817044,172.96,,2.61,106.06,115.85,False,0.0352,1000,116.1899,,116.0,112.6,https://logo.clearbit.com/jpmorganchase.com,,,,,,,
MCD,60607,Consumer Cyclical,100000.0,"McDonald's Corporation operates and franchises McDonald's restaurants in the United States and internationally. Its restaurants offer hamburgers and cheeseburgers, chicken sandwiches and nuggets, wraps, fries, salads, oatmeal, shakes, desserts, sundaes, soft serve cones, bakery items, soft drinks, coffee, and beverages and other beverages, as well as breakfast menu, including biscuit and bagel sandwiches, breakfast burritos, hotcakes, and other sandwiches. As of December 31, 2021, the company operated 40,031 restaurants. McDonald's Corporation was founded in 1940 and is headquartered in Chicago, Illinois.",Chicago,630 623 3000,IL,United States,[],https://corporate.mcdonalds.com,1,110 North Carpenter Street,Restaurants,0.45923,0.25773,0.55287,,-0.029,0.37827,10835300352.0,245.0,buy,12580200000,,285.0,258.53,-0.458,,,31.0,279.87,,,328.0,2357499904,47593799680,23594399744,3.188,USD,31.76,,2.1,NYQ,McDonald's Corporation,McDonald's Corporation,America/New_York,EDT,False,-14400000,EQUITY,finmb_139488,us_market,,10.132,,22.063,0.103191376,,10.61,,739547008.0,,,,-8.101,6097329,0.0082,,1640908800,0.69569,6081099776,8.12,1.38,-0.06414485,,0.0016699999,1703980800,,1656547200,2.26,1655251200,738526355,0.561203,239064154112,2,,920851200.0,2:1,,1654214400.0,,-0.465,8.10341,1657843200,3.7,,24.366636,,0.0083,6909804,0.0,,,260.64,259.64,250.3774,0.020833332,0.66870004,,260.0299,,2773430,260.64,249.9056,5.43,259.64,,2773430,,,5.52,1661904000.0,,,257.07,USD,31.83867,960726,,,,191195086848.0,,,2766145,257.07,258.59,900,960726,271.15,,2.31,217.68,258.54,False,0.0211,2200,260.0299,,258.53,258.849,https://logo.clearbit.com/corporate.mcdonalds.com,3.7428,,,,,,
MMM,55144-1000,Industrials,95000.0,"3M Company operates as a diversified technology company worldwide. It operates through four segments: Safety and Industrial; Transportation and Electronics; Health Care; and Consumer. The Safety and Industrial segment offers industrial abrasives and finishing for metalworking applications; autobody repair solutions; closure systems for personal hygiene products, masking, and packaging materials; electrical products and materials for construction and maintenance, power distribution, and electrical original equipment manufacturers; structural adhesives and tapes; respiratory, hearing, eye, and fall protection solutions; and natural and color-coated mineral granules for shingles. The Transportation and Electronics segment provides ceramic solutions; attachment tapes, films, sound, and temperature management for transportation vehicles; premium large format graphic films for advertising and fleet signage; light management films and electronics assembly solutions; packaging and interconnection solutions; and reflective signage for highway, and vehicle safety. The Healthcare segment offers food safety indicator solutions; health care procedure coding and reimbursement software; skin, wound care, and infection prevention products and solutions; dentistry and orthodontia solutions; and filtration and purification systems. The Consumer segment provides consumer bandages, braces, supports and consumer respirators; cleaning products for the home; retail abrasives, paint accessories, car care DIY products, picture hanging, and consumer air quality solutions; and stationery products. It offers its products through e-commerce and traditional wholesalers, retailers, jobbers, distributors, and dealers. The company was founded in 1902 and is based in St. Paul, Minnesota.",Saint Paul,651 733 1110,MN,United States,[],https://www.3m.com,1,3M Center,Conglomerates,0.24558,0.11828,0.44526002,6016999936.0,-0.028,0.19131,8615999488.0,118.0,hold,16579000000,3868499968.0,145.0,147.435,-0.947,1.467,0.08931,18.0,146.02,124.464,0.2938,210.0,2984000000,17195999232,35085000704,5.239,USD,61.076,0.798,3.4,NYQ,3M Company,3M Company,America/New_York,EDT,False,-14400000,EQUITY,finmb_289194,us_market,,2.737,,11.144,-0.25241005,,10.92,,569603968.0,,,,24.126,7765938,0.0136,,1640908800,0.67509,4150000128,7.16,1.49,-0.06414485,6.111042,0.00087,1703980800,,1656547200,2.44,1655251200,569091284,0.966653,96018464768,2,,1064880000.0,2:1,,1652918400.0,,-0.949,2.3936028,1657843200,34.45,,13.501373,,0.0137,9123534,0.0,,,148.12,147.01,156.58725,0.04010262,0.8296,,148.49,,4298060,148.12,136.8144,5.94,147.01,,4298060,,,5.96,1652918400.0,,,146.43,USD,20.59148,2679588,,,,83979558912.0,,,3123577,146.43,147.83,1300,2679588,202.77,,3.15,125.6,147.8,False,0.041500002,1100,148.49,,147.435,147.3,https://logo.clearbit.com/3m.com,2.4144,,,,,,
MRK,07033,Healthcare,67000.0,"Merck & Co., Inc. operates as a healthcare company worldwide. It operates through two segments, Pharmaceutical and Animal Health. The Pharmaceutical segment offers human health pharmaceutical products in the areas of oncology, hospital acute care, immunology, neuroscience, virology, cardiovascular, and diabetes, as well as vaccine products, such as preventive pediatric, adolescent, and adult vaccines. The Animal Health segment discovers, develops, manufactures, and markets veterinary pharmaceuticals, vaccines, and health management solutions and services, as well as digitally connected identification, traceability, and monitoring products. It serves drug wholesalers and retailers, hospitals, and government agencies; managed health care providers, such as health maintenance organizations, pharmacy benefit managers, and other institutions; and physicians and physician distributors, veterinarians, and animal producers. The company has collaborations with AstraZeneca PLC; Bayer AG; Eisai Co., Ltd.; Ridgeback Biotherapeutics; and Gilead Sciences, Inc. to jointly develop and commercialize long-acting treatments in HIV. Merck & Co., Inc. was founded in 1891 and is headquartered in Kenilworth, New Jersey.",Kenilworth,908 740 4000,NJ,United States,[],https://www.merck.com,1,2000 Galloping Hill Road,Drug Manufacturers—General,0.41970003,0.29,0.70769,,0.28,0.35391998,23993999360.0,85.0,buy,35463000000,,100.5,87.19,1.541,,,22.0,100.23,77.635,,115.0,8931999744,31793999872,57168998400,3.532,USD,22.61,,2.2,NYQ,"Merck & Company, Inc.","Merck & Co., Inc.",America/New_York,EDT,False,-14400000,EQUITY,finmb_288502,us_market,,4.242,,10.106,0.15084839,,7.4,,2528809984.0,,,,16.17,20333172,0.008,,1640908800,0.75276,16641000448,6.49,0.69,-0.06414485,5.392084,0.001,1703980800,,1656547200,1.64,1655251200,2525644019,0.324928,242482855936,2,,1622678400.0,1048:1000,,1655164800.0,,1.553,3.8922927,1657843200,1.13,,11.782433,,0.008,19947796,0.0,,,86.82,86.53,83.5628,0.030868465,0.41529998,,87.5,,8591340,86.82,90.5956,2.68,86.53,,8591340,,,2.76,1663113600.0,,,86.02,USD,13.434516,4860070,,,,222518476800.0,,,11348829,86.02,87.23,1400,4860070,95.72,,2.99,70.89,87.22,False,0.0315,800,87.5,,87.19,86.23,https://logo.clearbit.com/merck.com,1.1323,,,,,,
